{
  "schema_version": "1.0.0",
  "run_id": "fr-late-attach-001",
  "sequence": 1,
  "event_type": "source_baseline_recorded",
  "event_time": "2026-05-05T11:00:01Z",
  "hash_algorithm": "sha256",
  "canonicalization": {
    "algorithm": "json-canonicalization-scheme",
    "version": "1.0.0"
  },
  "event_payload_digest": "58629dcbef9cb117bed26122e979ca497c9e09738286b14db01a5fb7dfa2c72c",
  "prev_event_hash": "4d6029b63791f8e75dba0069b2a6a8a3ef58838d5bbd890dc2dfa6c32dd399b1",
  "event_hash": "070d2d157f606e472f5258d9e10fe53625ff7222e9f2f8cebb4eb0db978408ee",
  "recorder_identity": {
    "recorder_id": "sdp-trace-flight-recorder",
    "recorder_version": "0.9.0"
  },
  "redaction_state": {
    "state": "not_required"
  },
  "event_payload": {
    "summary": "Recorded source baseline from attachment point only",
    "trust_scope": "local_development_recorder",
    "artifact_role": "recorded_event",
    "source_baseline_hash": "02eff7b987cf1c3287a0db81f0f48805d1667af75d96d43dbbd2965263da6359",
    "source_kind": "git_tree"
  }
}
