{
  "schema_version": "1.0.0",
  "run_id": "fr-redaction-unresolved-001",
  "sequence": 0,
  "event_type": "run_started",
  "event_time": "2026-05-05T11:20:00Z",
  "hash_algorithm": "sha256",
  "canonicalization": {
    "algorithm": "json-canonicalization-scheme",
    "version": "1.0.0"
  },
  "event_payload_digest": "feebab0e6a8ac465b47b4dc5d187f860ecbe9311f6d435921588bdc7e0a53c67",
  "prev_event_hash": "0000000000000000000000000000000000000000000000000000000000000000",
  "event_hash": "6ff09d6a664b4c894eb590af98743fc3cac7ad93aa197ebeb8de715e73f92e22",
  "recorder_identity": {
    "recorder_id": "sdp-trace-flight-recorder",
    "recorder_version": "0.9.0"
  },
  "redaction_state": {
    "state": "not_required"
  },
  "event_payload": {
    "summary": "Started unresolved redaction fixture",
    "trust_scope": "local_development_recorder",
    "artifact_role": "recorded_event",
    "profile": "local_development_recorder",
    "attachment_mode": "full_run",
    "operator": {
      "id": "operator:fixture",
      "actor_type": "human_user",
      "display_name": "Fixture Operator"
    }
  }
}
